{
  "data_structure": "panel",
  "treatment_path": "staggered_absorbing",
  "estimand": "group_time_att",
  "comparison_group": "not_yet_treated",
  "has_never_treated": true,
  "pre_periods": 5,
  "post_periods": 4,
  "anticipation_risk": "moderate",
  "spillover_risk": "low",
  "composition_risk": "moderate",
  "treatment_reversal": false,
  "multiple_treatments": false,
  "continuous_or_intensity_treatment": false,
  "needs_covariates": true,
  "needs_dynamic_effects": true,
  "few_clusters": false,
  "cluster_level": "unit",
  "sample_size": 12000,
  "n_units": 600,
  "n_treated_units": 250,
  "n_time_periods": 10,
  "language": "r"
}
